<?xml version="1.0" encoding="UTF-8"?>
<!DOCTYPE beans PUBLIC "-//SPRING//DTD BEAN//EN" "http://www.springframework.org/dtd/spring-beans.dtd">

<beans>

	<!--
		A general purpose controller for the entire "Point of Sale (POS)" application, 
		exposed at the /rates.htm URL.  The id of a flow to launch should be passed
		in using the "_flowId" request parameter: e.g. /rates.htm?_flowId=getRate-flow
	-->
	<bean name="/rates.htm" class="org.springframework.webflow.executor.mvc.FlowController">
		<property name="flowLocator" ref="flowRegistry"/>
        <property name="cacheSeconds" value="5"/>
	</bean>

	<!-- Creates the registry of flow definitions for this application -->
    <bean id="flowRegistry" class="org.springframework.webflow.registry.XmlFlowRegistryFactoryBean">
    	<property name="flowLocations" value="/WEB-INF/flows/**/*-flow.xml"/>
	</bean>
	
	<bean id="formAction" class="org.springframework.webflow.action.FormAction">
		<property name="formObjectName" value="rateCriteria"/>
		<property name="formObjectClass" value="org.springframework.webflow.samples.shippingrate.domain.RateCriteria"/>
		<property name="formObjectScope" value="FLOW"/>
		<property name="validator">
			<bean class="org.springframework.webflow.samples.shippingrate.domain.RateCriteriaValidator"/>
		</property>
		<property name="validateUsingValidatorMethod" value="true"/>
	</bean>	
	
	<!-- Maps flow view-state view names to JSP templates -->
	<bean id="viewResolver" class="org.springframework.web.servlet.view.InternalResourceViewResolver">
		<property name="prefix" value="/WEB-INF/jsp/"/>
		<property name="suffix" value=".jsp"/>
	</bean>
	
</beans>