<?xml version="1.0" encoding="UTF-8"?>
<!DOCTYPE beans PUBLIC "-//SPRING//DTD BEAN//EN" "http://www.springframework.org/dtd/spring-beans.dtd">

<!--
  - Application context definition for Petclinic on JDBC.
	-->
<beans>
	
	<bean id="dynamo"
		class="org.springframework.beans.factory.dynamic.PropertiesDynamicObjectConverter"
	>
		<property name="location"><value>/org/springframework/beans/factory/dynamic/refresh.properties</value></property>
		<property name="expirySeconds"><value>20</value></property>
	</bean>
	 
	
	<bean id="dynamic1"
		class="org.springframework.beans.TestBean">
	</bean>
	
	<bean id="static1"
		class="org.springframework.beans.TestBean">
	</bean>

	
</beans>
