<?xml version="1.0" encoding="UTF-8"?>
<!DOCTYPE beans PUBLIC "-//SPRING//DTD BEAN//EN" "http://www.springframework.org/dtd/spring-beans.dtd">
<beans>

	<bean id="jmxAdapter" class="org.springframework.jmx.MBeanExporter">
		<property name="beans">
			<map>
				<entry key="namingTest">
					<ref local="testBean"/>
				</entry>
			</map>
		</property>
		<property name="assembler">
			<ref local="metadataAssembler"/>
		</property>
		<property name="namingStrategy">
			<ref local="metadataNamingStrategy"/>
		</property>
	</bean>

	<bean id="testBean" class="org.springframework.jmx.AnnotationTestBean">
		<property name="name">
			<value>TEST</value>
		</property>
		<property name="age">
			<value>100</value>
		</property>
	</bean>

	<bean id="attributeSource" class="org.springframework.jmx.metadata.support.annotations.AnnotationsJmxAttributeSource"/>


	<bean id="metadataNamingStrategy" class="org.springframework.jmx.naming.MetadataNamingStrategy">
		<property name="attributeSource">
			<ref bean="attributeSource"/>
		</property>
	</bean>

	<bean id="metadataAssembler" class="org.springframework.jmx.assembler.MetadataModelMBeanInfoAssembler">
		<property name="attributeSource">
			<ref bean="attributeSource"/>
		</property>
	</bean>

</beans>