<?xml version="1.0" encoding="UTF-8"?>
<!DOCTYPE beans PUBLIC "-//SPRING//DTD BEAN//EN" "http://www.springframework.org/dtd/spring-beans.dtd">

<beans>

	<bean class="org.springframework.scripting.support.ScriptFactoryPostProcessor">
		<property name="refreshCheckDelay" value="1"/>
	</bean>

	<bean id="calculator" class="org.springframework.scripting.groovy.GroovyScriptFactory">
		<constructor-arg value="classpath:org/springframework/scripting/groovy/Calculator.groovy"/>
	</bean>

	<bean id="messenger" class="org.springframework.scripting.groovy.GroovyScriptFactory">
		<constructor-arg value="classpath:org/springframework/scripting/groovy/Messenger.groovy"/>
		<property name="message" value="Hello World!"/>
	</bean>

</beans>
