<?xml version="1.0" encoding="UTF-8"?>
<!DOCTYPE beans PUBLIC "-//SPRING//DTD BEAN//EN" "http://www.springframework.org/dtd/spring-beans.dtd">

<!--
  - Application context definition for Petclinic on JDBC.
	-->
<beans>
	
	<bean id="groovyScriptFactory"
		class="org.springframework.beans.factory.groovy.GroovyScriptFactory"
	>
		<property name="expirySeconds"><value>20</value></property>
	</bean>
	 
	<bean id="simpleSingleton"
		factory-bean="groovyScriptFactory"
		factory-method="create"
	>
		<constructor-arg index="0"><value>org/springframework/beans/factory/groovy/SimpleHello.groovy</value></constructor-arg>
	</bean>
	
	<!--
		Must be a singleton or the DynamicScriptInterceptor
		fails when getting the bean from the factory
	-->
	<bean id="propertySingleton"
		singleton="true"
		factory-bean="groovyScriptFactory"
		factory-method="create"
	>
		<constructor-arg index="0"><value>org/springframework/beans/factory/groovy/PropertyHello.groovy</value></constructor-arg>
		
		<!-- Property on created Groovy object -->
		<property name="message"><value>hello world property</value></property>
	</bean>
	
	<bean id="propertyPrototype"
		singleton="false"
		factory-bean="groovyScriptFactory"
		factory-method="create"
	>
		<constructor-arg index="0"><value>org/springframework/beans/factory/groovy/PropertyHello.groovy</value></constructor-arg>
		
		<!-- Property on created Groovy object -->
		<property name="message"><value>propertyPrototype</value></property>
	</bean>
	
	<bean id="dependsOnProperty" 
		class="org.springframework.beans.factory.groovy.DelegatingHello">
		<!-- Depends on dynamic hello -->
		<property name="hello"><ref local="propertySingleton"></ref></property>
	</bean>
	
	<bean id="bad"
		factory-bean="groovyScriptFactory"
		factory-method="create"
		singleton="false"
	>
		<constructor-arg index="0"><value>org/springframework/beans/factory/groovy/Bad.groovy</value></constructor-arg>
	</bean>

	
</beans>
