<?xml version="1.0" encoding="UTF-8" ?>
<!DOCTYPE beans PUBLIC "-//SPRING//DTD BEAN//EN" "http://www.springframework.org/dtd/spring-beans.dtd">

<beans>

	<!-- ===========================================================-->
	<!-- Views														-->
	<!-- ===========================================================-->
	<!-- Explicit view mappings in bundle instead of default InternalResourceViewResolver.
	  - Fetches the view mappings from localized "views_xx" classpath files, i.e.
	  - "/WEB-INF/classes/views-countries.properties" or "/WEB-INF/classes/views-countries_fr.properties".
	  -
	  - Symbolic view names returned by controllers will be resolved in the respective
	  - properties file, allowing for arbitrary mappings between names and resources.
	  -
	  - We use the "defaultParentView" property. All views defined will inherit by default the properties
	  - defined in the "modelView" view.
	  -->
	<bean id="viewResolver" class="org.springframework.web.servlet.view.ResourceBundleViewResolver">			
		<property name="basename"><value>views-lcountries</value></property>
		<property name="defaultParentView"><value>modelView</value></property>
	</bean>

	<!-- ===========================================================-->
	<!-- Resolvers													-->
	<!-- ===========================================================-->
	<!-- We specify here that Locale and theme are stored in cookies.
	     They could be stored in a Session. Default resolvers don't allow changing them on the fly.
	-->
	<bean id="localeResolver" class="org.springframework.web.servlet.i18n.CookieLocaleResolver"/>
	<bean id="themeResolver" class="org.springframework.web.servlet.theme.CookieThemeResolver"/>

	<!-- ===========================================================-->
	<!-- Interceptors												-->
	<!-- ===========================================================-->
	<!-- Interceptors will pre-handle any request in this servlet, no matter which is the controller 
	     mapped for this request.
	     We use two built-in interceptors to detect user locale or theme change requests.
	     
	     The third interceptor is specific to this Demo. It allows views to easily be aware
	     about the configuration detected. Precisely to know if a copy data to database can be 
	     proposed to the user.
	-->
	<bean id="localeChangeInterceptor" class="org.springframework.web.servlet.i18n.LocaleChangeInterceptor"/>
	<bean id="themeChangeInterceptor" class="org.springframework.web.servlet.theme.ThemeChangeInterceptor"/>

	<!-- ===========================================================-->
	<!-- Mapping													-->
	<!-- ===========================================================-->
	<!--
	 - Explicit URL handler mapping instead of default BeanNameUrlHandlerMapping.
	 -->
	<bean id="urlMapping" class="org.springframework.web.servlet.handler.SimpleUrlHandlerMapping"> 
		<property name="interceptors">
			<list>
				<ref bean="localeChangeInterceptor"/>
				<ref bean="themeChangeInterceptor"/>
			</list>
		</property>
		<property name="mappings">
			<props>
				<prop key="/home.htm">lcountriesController</prop>
				<prop key="/config.htm">lcountriesController</prop>
				<prop key="/main/home.htm">lcountriesController</prop>
				<prop key="/main/detail.htm">lcountriesController</prop>
				<prop key="/main/countries.xls">lcountriesController</prop>
				<prop key="/main/countries.pdf">lcountriesController</prop>
				<prop key="/notfound.htm">errorsController</prop>
			</props>
		</property>
	</bean>
  
	<!-- ===========================================================-->
	<!-- Controllers												-->
	<!-- ===========================================================-->
	<!-- MultiControllers need a MethodNameResolver to mapping URLs to methods. -->

	<!-- ===========================================================-->
	<!-- General use Multiaction controller for Errors -->

	<bean id="errorsMethodNameResolver" class="org.springframework.web.servlet.mvc.multiaction.PropertiesMethodNameResolver">
		<property name="mappings">
			<props>
				<prop key="/notfound.htm">handleHttp404</prop>
			</props>
		</property>
	</bean>

	<bean id="errorsController" class="org.springframework.samples.lightcountries.web.ErrorsController">
		<property name="methodNameResolver"><ref bean="errorsMethodNameResolver"/></property>
	</bean>

	<!-- ===========================================================-->
	<!-- Application specific Multiaction controller -->

	<bean id="lcountriesMethodNameResolver" class="org.springframework.web.servlet.mvc.multiaction.PropertiesMethodNameResolver">
		<property name="mappings">
			<props>
				<prop key="/home.htm">handleHome</prop>
				<prop key="/config.htm">handleConfig</prop>
				<prop key="/main/home.htm">handleMain</prop>
				<prop key="/main/detail.htm">handleDetail</prop>
				<prop key="/main/countries.xls">handleExcel</prop>
				<prop key="/main/countries.pdf">handlePdf</prop>
			</props>
		</property>
	</bean>

	<bean id="lcountriesController" class="org.springframework.samples.lightcountries.web.CountriesController">
		<property name="methodNameResolver"><ref bean="lcountriesMethodNameResolver"/></property>
		<property name="daoCountry"><ref external="daoCountry"/></property>
		<!--
		<property name="homeView"><value>homeView</value></property>
		<property name="configView"><value>configView</value></property>
		<property name="mainView"><value>countries_mainView</value></property>
		<property name="detailView"><value>countries_detailView</value></property>
		<property name="excelView"><value>countries_excelView</value></property>
		<property name="pdfView"><value>countries_pdfView</value></property>
		-->
	</bean>
	
</beans>
