<?xml version="1.0" encoding="UTF-8"?>
<!DOCTYPE beans PUBLIC "-//SPRING//DTD BEAN//EN" 
	"http://www.springframework.org/dtd/spring-beans.dtd">

<!-- Application context definition -->

<beans>

	<bean id="flowExecutionManager" class="org.springframework.webflow.execution.FlowExecutionManager">
		<constructor-arg>
			<bean class="org.springframework.webflow.execution.FlowExecutionManagerTests$SimpleFlowLocator"/>
		</constructor-arg>
		<property name="storage">
			<bean class="org.springframework.webflow.execution.ContinuationDataStoreFlowExecutionStorage"/>
		</property>
		<property name="listener">
			<bean class="org.springframework.webflow.execution.FlowExecutionManagerTests$SimpleFlowExecutionListener"/>
		</property>
		<property name="transactionSynchronizer">
			<bean class="org.springframework.webflow.execution.DataStoreTokenTransactionSynchronizer"/>
		</property>
	</bean>

</beans>