<?xml version="1.0" encoding="UTF-8"?>
<!DOCTYPE beans PUBLIC "-//SPRING//DTD BEAN//EN" "http://www.springframework.org/dtd/spring-beans.dtd">
<beans>

	<bean id="jmxAdapter5" class="org.springframework.jmx.JmxMBeanAdapter">
	    <property name="beans">
			<map>
				<entry key="bean:name=testBean3">
					<ref local="testBean"/>
				</entry>
			</map>
		</property>
		<property name="assembler">
	        <ref local="metadataAssembler"/>
	    </property>
	</bean>

	<bean id="jmxAdapter6" class="org.springframework.jmx.JmxMBeanAdapter">
	    <property name="beans">
			<map>
				<entry key="namingTest">
					<ref local="testBean"/>
				</entry>
			</map>
		</property>
		<property name="namingStrategy">
	        <ref local="metadataNamingStrategy"/>
	    </property>
	</bean>

	<bean id="testBean" class="org.springframework.jmx.JmxTestBean">
		<property name="name">
			<value>TEST</value>
		</property>
		<property name="age">
			<value>100</value>
		</property>
	</bean>



	<bean id="metadataNamingStrategy" class="org.springframework.jmx.naming.MetadataNamingStrategy">
	</bean>

	<bean id="metadataAssembler" class="org.springframework.jmx.assemblers.metadata.MetadataModelMBeanInfoAssembler">

	</bean>

</beans>