<?xml version="1.0" encoding="UTF-8"?>
<!DOCTYPE beans PUBLIC  "-//SPRING//DTD BEAN//EN" "http://www.springframework.org/dtd/spring-beans.dtd">

<beans>

	<bean id="dependingBean" class="org.springframework.beans.factory.xml.XmlBeanFactoryTestSuite$DependingBean">
		<constructor-arg index="0"><ref local="preparingBean1"/></constructor-arg>
		<constructor-arg index="1"><ref local="preparingBean2"/></constructor-arg>
	</bean>

	<bean id="preparingBean1" class="org.springframework.beans.factory.xml.XmlBeanFactoryTestSuite$PreparingBean1"/>

	<bean id="preparingBean2" class="org.springframework.beans.factory.xml.XmlBeanFactoryTestSuite$PreparingBean2"/>

</beans>
