<?xml version="1.0" encoding="UTF-8"?>
<!DOCTYPE beans PUBLIC "-//SPRING//DTD BEAN//EN" "http://www.springframework.org/dtd/spring-beans.dtd">

<beans>

	<bean id="dataSource" class="org.springframework.jdbc.datasource.DriverManagerDataSource">
		<property name="driverClassName"><value>org.hsqldb.jdbcDriver</value></property>
		<property name="url"><value>jdbc:hsqldb:hsql://localhost:9001</value></property>
		<property name="username"><value>sa</value></property>
		<property name="password"><value></value></property>
	</bean>

	<bean id="ojbConfigurer" class="org.springframework.orm.ojb.support.LocalOjbConfigurer"/>

	<bean id="transactionManager" class="org.springframework.orm.ojb.PersistenceBrokerTransactionManager"/>

	<bean id="clinicTarget" class="org.springframework.samples.petclinic.ojb.PersistenceBrokerClinic"/>

	<bean id="clinic" class="org.springframework.transaction.interceptor.TransactionProxyFactoryBean">
		<property name="transactionManager"><ref local="transactionManager"/></property>
		<property name="target"><ref local="clinicTarget"/></property>
		<property name="transactionAttributes">
			<props>
				<prop key="*">PROPAGATION_REQUIRED</prop>
			</props>
		</property>
	</bean>

</beans>
